{
  "operation_type": "sale",
  "operation_time": "2022-01-01T03:25+03:00",
  "operation_place": "Aeroflot",
  "passenger": {
    "name": "Dmitrii",
    "surname": "Makarov",
    "patronymic": "Pavlovich",
    "doc_type": "00",
    "doc_number": "3108111434",
    "birthdate": "2001-07-12",
    "gender": "M",
    "passenger_type": "youth",
    "ticket_number": "5552139265672",
    "ticket_type": 1
  },
  "routes": [{
    "airline_code": "SU",
    "flight_num": 1701,
    "depart_place": "AAQ",
    "depart_datetime": "2022-01-02T09:20+10:00",
    "arrive_place": "NSK",
    "arrive_datetime": "2022-01-02T11:25+03:00",
    "pnr_id": "THALSZ"
  }
  ]
}
